{
  "schemaVersion": 1,
  "releaseId": "development",
  "resolvedAt": "2026-07-20T15:13:59Z",
  "components": {
    "artifacts-const-generics": {
      "kind": "artifact-processor",
      "resolvedVersion": "a2042c704a93-79f7f1408b2c-ctarg-v1",
      "commit": "a2042c704a935a5402c6d700626e52702866ed6d",
      "digest": "sha256:2b4f80b014d2bdacb71031c42cf3df6c9fef8194f5b4cc2a39c473f2c9f44b7e",
      "sourceUri": "https://github.com/ilyfairy/ILSpy/tree/a2042c704a935a5402c6d700626e52702866ed6d",
      "releaseDate": "2025-02-28"
    },
    "artifacts-default": {
      "kind": "artifact-processor",
      "resolvedVersion": "ilspy/10.1.0.8386+ilverify/10.0.9"
    },
    "artifacts-jsil": {
      "kind": "artifact-processor",
      "resolvedVersion": "0.8.2+mono.6.12.0.182",
      "commit": "1d57d5427c87ab92ffa3ca4b82429cd7509796ba",
      "digest": "sha256:e165f0f03274068cab1a9738685b0e5322ce52f4066d365c7e53c3562304414c",
      "sourceUri": "https://github.com/sq/JSIL/tree/1d57d5427c87ab92ffa3ca4b82429cd7509796ba"
    },
    "wine-coreclr-userspace": {
      "kind": "runtime-dependency",
      "resolvedVersion": "wine-9.0~repack-4build3+xvfb-2:21.1.12-1ubuntu1.6",
      "digest": "sha256:4ecfff207a9b13eb6492aa3f9ca01d2d3dd1b713837ef2917524eaf23fa55981",
      "sourceUri": "https://snapshot.ubuntu.com/ubuntu/20260810T000000Z/"
    },
    "const-generics-ilspy-source": {
      "kind": "source",
      "resolvedVersion": "a2042c704a935a5402c6d700626e52702866ed6d",
      "commit": "a2042c704a935a5402c6d700626e52702866ed6d",
      "digest": "sha256:2b4f80b014d2bdacb71031c42cf3df6c9fef8194f5b4cc2a39c473f2c9f44b7e",
      "sourceUri": "https://codeload.github.com/ilyfairy/ILSpy/tar.gz/a2042c704a935a5402c6d700626e52702866ed6d",
      "releaseDate": "2025-02-28"
    },
    "const-generics-linux-x64": {
      "kind": "runtime",
      "resolvedVersion": "9.0.0-constgenerics.1.23470.1",
      "commit": "79f7f1408b2c811904c983419b45139e654f1e46",
      "jitCommit": "79f7f1408b2c811904c983419b45139e654f1e46",
      "sourceUri": "https://github.com/hez2010/runtime/tree/79f7f1408b2c811904c983419b45139e654f1e46",
      "releaseDate": "2023-09-20"
    },
    "const-generics-ref": {
      "kind": "reference-set",
      "resolvedVersion": "9.0.0-constgenerics.1.23470.1",
      "commit": "79f7f1408b2c811904c983419b45139e654f1e46",
      "digest": "sha256:00f0f9fcfc083e931004ceaa914633990ad7e389ce8d21012b97af5844f501b4",
      "sourceUri": "https://codeload.github.com/hez2010/runtime/tar.gz/79f7f1408b2c811904c983419b45139e654f1e46",
      "releaseDate": "2023-09-20"
    },
    "const-generics-roslyn-source": {
      "kind": "source",
      "resolvedVersion": "bcd209abd947ac1bc71ef1ee29bd8a02d8e78ffc",
      "commit": "bcd209abd947ac1bc71ef1ee29bd8a02d8e78ffc",
      "digest": "sha256:e43c77373cc7dc07a58a73516fce5512f441b5435e7d17d0e18af41942dc7487",
      "sourceUri": "https://codeload.github.com/hez2010/roslyn/tar.gz/bcd209abd947ac1bc71ef1ee29bd8a02d8e78ffc",
      "releaseDate": "2023-09-08"
    },
    "const-generics-runtime-source": {
      "kind": "source",
      "resolvedVersion": "79f7f1408b2c811904c983419b45139e654f1e46",
      "commit": "79f7f1408b2c811904c983419b45139e654f1e46",
      "digest": "sha256:00f0f9fcfc083e931004ceaa914633990ad7e389ce8d21012b97af5844f501b4",
      "sourceUri": "https://codeload.github.com/hez2010/runtime/tar.gz/79f7f1408b2c811904c983419b45139e654f1e46",
      "releaseDate": "2023-09-20"
    },
    "const-generics-versiontools": {
      "kind": "build-dependency",
      "resolvedVersion": "8.0.0-beta.23516.4",
      "digest": "sha256:ad0a9c0ef28dd49bd2bfd7eb1be7ec355bd11a9671c0e2d8f1c08016b56be1bf",
      "sourceUri": "https://pkgs.dev.azure.com/dnceng/public/_packaging/dotnet-eng/nuget/v3/flat2/microsoft.dotnet.versiontools.tasks/8.0.0-beta.23516.4/microsoft.dotnet.versiontools.tasks.8.0.0-beta.23516.4.nupkg",
      "package": "Microsoft.DotNet.VersionTools.Tasks"
    },
    "dotnet-10-linux-x64": {
      "kind": "runtime",
      "resolvedVersion": "10.0.10",
      "commit": "f7d90799ce4ef09a0bb257852a57248d2a8fb8dd",
      "jitCommit": "f7d90799ce4ef09a0bb257852a57248d2a8fb8dd",
      "sourceUri": "https://builds.dotnet.microsoft.com/dotnet/Runtime/10.0.10/dotnet-runtime-10.0.10-linux-x64.tar.gz",
      "sha512": "74b2b41ee177fe72da02741d5ba30e8a3c5ead44151d7a72a04ed81a0a933e827f5f8cfcc048ba4e8de5aeb7651953761b7586277d0bcce2e01323ca29ccb813",
      "releaseDate": "2026-07-14"
    },
    "dotnet-11-preview-linux-x64": {
      "kind": "runtime",
      "resolvedVersion": "11.0.0-preview.6.26359.118",
      "commit": "ba53d0ed335bed4ab7bfd01988c8e3953ee5ffbe",
      "jitCommit": "ba53d0ed335bed4ab7bfd01988c8e3953ee5ffbe",
      "sourceUri": "https://builds.dotnet.microsoft.com/dotnet/Runtime/11.0.0-preview.6.26359.118/dotnet-runtime-11.0.0-preview.6.26359.118-linux-x64.tar.gz",
      "sha512": "ce5530c0314dd38d6f1b8348fbddf65341cee31e05ebddfd7906937c785d799c0d2b95f920d0457f5de5371bd0ede98df9fd8c9588ee58029864d599dd6e1565",
      "releaseDate": "2026-07-14"
    },
    "dotnet-5-linux-x64": {
      "kind": "runtime",
      "resolvedVersion": "5.0.17",
      "commit": "6a984143635bde23e728abaaccbde52f5ea8fa3e",
      "jitCommit": "6a984143635bde23e728abaaccbde52f5ea8fa3e",
      "sourceUri": "https://builds.dotnet.microsoft.com/dotnet/Runtime/5.0.17/dotnet-runtime-5.0.17-linux-x64.tar.gz",
      "sha512": "a9c4784930a977abbc42aff1337dda06ec588c1ec4769a59f9fcab4d5df4fc9efe65f8e61e5433db078f67a94ea2dfe870c32c482a50d4c16283ffacacff4261",
      "releaseDate": "2022-05-10"
    },
    "dotnet-6-linux-x64": {
      "kind": "runtime",
      "resolvedVersion": "6.0.36",
      "commit": "f1dd57165bfd91875761329ac3a8b17f6606ad18",
      "jitCommit": "f1dd57165bfd91875761329ac3a8b17f6606ad18",
      "sourceUri": "https://builds.dotnet.microsoft.com/dotnet/Runtime/6.0.36/dotnet-runtime-6.0.36-linux-x64.tar.gz",
      "sha512": "afb6018fcabec468ccd7ae2f1131d8c9de7f4de7645b8f0c223efbbdbfdc515fb0642a399ebfe372c02044416c4cae463c9c802cd156b9da4181efff0e33ee94",
      "releaseDate": "2024-11-12"
    },
    "dotnet-7-linux-x64": {
      "kind": "runtime",
      "resolvedVersion": "7.0.20",
      "commit": "0fb6ac59fb1edbe4ed3ad62661df0eb7eacd7903",
      "jitCommit": "0fb6ac59fb1edbe4ed3ad62661df0eb7eacd7903",
      "sourceUri": "https://builds.dotnet.microsoft.com/dotnet/Runtime/7.0.20/dotnet-runtime-7.0.20-linux-x64.tar.gz",
      "sha512": "87855297338555a7b577d7e314e5dbf2c2350f8c867a489cd1e535634bad5c123a1871464d37fc9421837ff5d426c2eadecbe0f60bbf3fd32bc2461f47790a40",
      "releaseDate": "2024-05-28"
    },
    "dotnet-8-linux-x64": {
      "kind": "runtime",
      "resolvedVersion": "8.0.29",
      "commit": "18fd75c847399745c43b5970fec840ba71064e80",
      "jitCommit": "18fd75c847399745c43b5970fec840ba71064e80",
      "sourceUri": "https://builds.dotnet.microsoft.com/dotnet/Runtime/8.0.29/dotnet-runtime-8.0.29-linux-x64.tar.gz",
      "sha512": "2739a48f5ec81738d05376f7bf26b2efc5297639db3f4748b458d54bf795a084c5bd47886449b9996eb1a3371bb8c3900d72049e8f0150d0a5ac8230ef38a65e",
      "releaseDate": "2026-07-14"
    },
    "dotnet-9-linux-x64": {
      "kind": "runtime",
      "resolvedVersion": "9.0.18",
      "commit": "d839c41c85988aadc213e8e42269ecd7883a1790",
      "jitCommit": "d839c41c85988aadc213e8e42269ecd7883a1790",
      "sourceUri": "https://builds.dotnet.microsoft.com/dotnet/Runtime/9.0.18/dotnet-runtime-9.0.18-linux-x64.tar.gz",
      "sha512": "97eb89a5a3781b9761e2a850996912ae81b96996089c78abcebbc441113457088bfcbd7cf1fa97d3036f7ac8fe22c7d30e043e93ecafc910f07b73317c73bad5",
      "releaseDate": "2026-07-14"
    },
    "dotnet-core-2.0-linux-x64": {
      "kind": "runtime",
      "resolvedVersion": "2.0.9",
      "commit": "1632fa1589b0eee3277a8841ce1770e554ece037",
      "jitCommit": "1632fa1589b0eee3277a8841ce1770e554ece037",
      "sourceUri": "https://builds.dotnet.microsoft.com/dotnet/Runtime/2.0.9/dotnet-runtime-2.0.9-linux-x64.tar.gz",
      "sha512": "2b49b24ef712fbfc056e0fda95ff18037b4ec938ca8bb41f4c336b6a50870e922f5093684ac92c4bb8e1155b03c36d132d7f90817793f31c9ade5267fff6629a",
      "releaseDate": "2018-07-10"
    },
    "dotnet-core-2.1-linux-x64": {
      "kind": "runtime",
      "resolvedVersion": "2.1.30",
      "commit": "5e17f34de8b34fce04f665640e046d89e8991d00",
      "jitCommit": "5e17f34de8b34fce04f665640e046d89e8991d00",
      "sourceUri": "https://builds.dotnet.microsoft.com/dotnet/Runtime/2.1.30/dotnet-runtime-2.1.30-linux-x64.tar.gz",
      "sha512": "b7433c9f03f7363759a044b50d8cca9486cfe402fdf62163696ba6a172e9839a140553e3d3298bb75c89dda2f6f4bec294847411f3fc2796fa4881a2b01a7178",
      "releaseDate": "2021-08-19"
    },
    "dotnet-core-2.2-linux-x64": {
      "kind": "runtime",
      "resolvedVersion": "2.2.8",
      "commit": "b9aa1abc510165cdc4c92e59d938def6f3eee0e1",
      "jitCommit": "b9aa1abc510165cdc4c92e59d938def6f3eee0e1",
      "sourceUri": "https://builds.dotnet.microsoft.com/dotnet/Runtime/2.2.8/dotnet-runtime-2.2.8-linux-x64.tar.gz",
      "sha512": "b818557b0090ec047be0fb2e5ffee212e23e8417e1b0164f455e3a880bf5b94967dc4c86d6ed82397af9acc1f7415674904f6225a1abff85d28d2a6d5de8073b",
      "releaseDate": "2019-11-19"
    },
    "dotnet-core-3.0-linux-x64": {
      "kind": "runtime",
      "resolvedVersion": "3.0.3",
      "commit": "c03f2fe62663edec83d1bc12b4e9f11bd3de5d0e",
      "jitCommit": "c03f2fe62663edec83d1bc12b4e9f11bd3de5d0e",
      "sourceUri": "https://builds.dotnet.microsoft.com/dotnet/Runtime/3.0.3/dotnet-runtime-3.0.3-linux-x64.tar.gz",
      "sha512": "3d1f0ba2f293f43e087a8940a0f4736561f43b9f28bc5beda79a61f887e258543aea4dc71e88414a7c6e271dcda984a989afb62fc659a72223707a179cdde9c5",
      "releaseDate": "2020-02-18"
    },
    "dotnet-core-3.1-linux-x64": {
      "kind": "runtime",
      "resolvedVersion": "3.1.32",
      "commit": "f94bb2c3ff432dcc4a6229eca2f978197bf06150",
      "jitCommit": "f94bb2c3ff432dcc4a6229eca2f978197bf06150",